stimulus_id,stimulus_text,response_start,response_end,response_duration,response_file,transcription,text_prompted,text_plain,asr_strategy,over_anchored,cross_wer,transcription_norm,stimulus_norm,wer,cer,learner_wer,learner_score,asr_wer,word_f1,n_ref_words,n_hyp_words,no_speech_prob,asr_status,backend,elapsed_s,word_timestamps
1,Quiero cortarme el pelo,6.0,8.0,2.0,eit_output_v3/038011_1A_preprocessed/responses/response_01.wav,quiero cortarme el pelo,quiero cortarme el pelo,Quiero cortarme el pelo.,prompted,False,0.0,quiero cortarme el pelo,quiero cortarme el pelo,0.0,0.0,0.0,1.0,,1.0,4,4,0.1141,OK,mlx,9.722999999999999,"[{""word"": ""quiero"", ""start"": 0.0, ""end"": 0.36, ""probability"": 0.057403564453125}, {""word"": ""cortarme"", ""start"": 0.36, ""end"": 1.12, ""probability"": 0.9599609375}, {""word"": ""el"", ""start"": 1.12, ""end"": 1.4, ""probability"": 0.96435546875}, {""word"": ""pelo"", ""start"": 1.4, ""end"": 1.74, ""probability"": 0.9990234375}]"
2,El libro está en la mesa,13.2,14.8,1.6,eit_output_v3/038011_1A_preprocessed/responses/response_02.wav,El libro está en la mesa.,El libro está en la mesa.,El libro está en la mesa.,prompted,False,0.0,el libro está en la mesa,el libro está en la mesa,0.0,0.0,0.0,1.0,,1.0,6,6,0.0006,OK,mlx,6.253,"[{""word"": ""El"", ""start"": 0.0, ""end"": 0.2, ""probability"": 0.98974609375}, {""word"": ""libro"", ""start"": 0.2, ""end"": 0.48, ""probability"": 0.998046875}, {""word"": ""está"", ""start"": 0.48, ""end"": 0.8, ""probability"": 0.99267578125}, {""word"": ""en"", ""start"": 0.8, ""end"": 0.96, ""probability"": 0.99951171875}, {""word"": ""la"", ""start"": 0.96, ""end"": 1.1, ""probability"": 0.9990234375}, {""word"": ""mesa."", ""start"": 1.1, ""end"": 1.38, ""probability"": 1.0}]"
3,El carro lo tiene Pedro,20.6,22.4,1.8,eit_output_v3/038011_1A_preprocessed/responses/response_03.wav,el carro no tiene Pedro,el carro no tiene Pedro,El carro no tiene pelo.,prompted,False,0.2,el carro no tiene pedro,el carro lo tiene pedro,0.2,0.0435,0.2,0.8,,0.8,5,5,0.0007,OK,mlx,5.7669999999999995,"[{""word"": ""el"", ""start"": 0.0, ""end"": 0.28, ""probability"": 0.036346435546875}, {""word"": ""carro"", ""start"": 0.28, ""end"": 0.56, ""probability"": 0.96923828125}, {""word"": ""no"", ""start"": 0.56, ""end"": 0.88, ""probability"": 0.990234375}, {""word"": ""tiene"", ""start"": 0.88, ""end"": 1.16, ""probability"": 0.99462890625}, {""word"": ""Pedro"", ""start"": 1.16, ""end"": 1.56, ""probability"": 6.586313247680664e-05}]"
4,El se ducha cada mañana,28.6,31.1,2.5,eit_output_v3/038011_1A_preprocessed/responses/response_04.wav,ahora se ducha cada mañana,ahora se ducha cada mañana,La seducha cada mañana.,prompted,False,0.6,ahora se ducha cada mañana,el se ducha cada mañana,0.2,0.2174,0.2,0.8,,0.8,5,5,0.0284,OK,mlx,5.55,"[{""word"": ""ahora"", ""start"": 0.0, ""end"": 0.22, ""probability"": 0.00728607177734375}, {""word"": ""se"", ""start"": 0.22, ""end"": 0.42, ""probability"": 0.77197265625}, {""word"": ""ducha"", ""start"": 0.42, ""end"": 0.8, ""probability"": 0.900390625}, {""word"": ""cada"", ""start"": 0.8, ""end"": 1.8, ""probability"": 0.93408203125}, {""word"": ""mañana"", ""start"": 1.8, ""end"": 2.18, ""probability"": 0.98828125}]"
5,¿Qué dice usted que va a hacer hoy?,37.7,39.9,2.2,eit_output_v3/038011_1A_preprocessed/responses/response_05.wav,¿Qué dice usted que va a hacer hoy?,¿Qué dice usted que va a hacer hoy?,¿Qué dice usted que va a hacer hoy?,prompted,False,0.0,qué dice usted que va a hacer hoy,qué dice usted que va a hacer hoy,0.0,0.0,0.0,1.0,,1.0,8,8,0.0,OK,mlx,7.032,"[{""word"": ""¿Qué"", ""start"": 0.0, ""end"": 0.28, ""probability"": 0.9521484375}, {""word"": ""dice"", ""start"": 0.28, ""end"": 0.54, ""probability"": 0.98583984375}, {""word"": ""usted"", ""start"": 0.54, ""end"": 0.92, ""probability"": 0.990234375}, {""word"": ""que"", ""start"": 0.92, ""end"": 1.38, ""probability"": 0.96728515625}, {""word"": ""va"", ""start"": 1.38, ""end"": 1.6, ""probability"": 0.9853515625}, {""word"": ""a"", ""start"": 1.6, ""end"": 1.6, ""probability"": 0.99169921875}, {""word"": ""hacer"", ""start"": 1.6, ""end"": 1.84, ""probability"": 0.98388671875}, {""word"": ""hoy?"", ""start"": 1.84, ""end"": 2.08, ""probability"": 0.99609375}]"
6,Dudo que sepa manejar muy bien,46.8,49.9,3.1,eit_output_v3/038011_1A_preprocessed/responses/response_06.wav,tuvo que se manejar bien,tuvo que se manejar bien,Tuve que manejar bien.,prompted,False,0.4,tuvo que se manejar bien,dudo que sepa manejar muy bien,0.5,0.2667,0.5,0.5,,0.5455,6,5,0.0024,OK,mlx,6.871,"[{""word"": ""tuvo"", ""start"": 0.0, ""end"": 0.32, ""probability"": 0.042144775390625}, {""word"": ""que"", ""start"": 0.32, ""end"": 1.2, ""probability"": 0.9404296875}, {""word"": ""se"", ""start"": 1.2, ""end"": 1.74, ""probability"": 0.521484375}, {""word"": ""manejar"", ""start"": 1.74, ""end"": 2.56, ""probability"": 0.98388671875}, {""word"": ""bien"", ""start"": 2.56, ""end"": 2.8, ""probability"": 0.98828125}]"
7,Las calles de esta ciudad son muy anchas,56.7,61.4,4.7,eit_output_v3/038011_1A_preprocessed/responses/response_07.wav,las calles han salido muchas años,las calles han salido muchas años,Las caes en salidad muchas años.,prompted,False,0.5,las calles han salido muchas años,las calles de esta ciudad son muy anchas,0.75,0.5,0.75,0.25,,0.2857,8,6,0.0533,OK,mlx,60.646,"[{""word"": ""las"", ""start"": 0.0, ""end"": 0.3, ""probability"": 0.08251953125}, {""word"": ""calles"", ""start"": 0.3, ""end"": 1.12, ""probability"": 0.65234375}, {""word"": ""han"", ""start"": 1.12, ""end"": 1.28, ""probability"": 0.05584716796875}, {""word"": ""salido"", ""start"": 1.28, ""end"": 1.96, ""probability"": 0.6650390625}, {""word"": ""muchas"", ""start"": 1.96, ""end"": 2.6, ""probability"": 0.483154296875}, {""word"": ""años"", ""start"": 2.6, ""end"": 4.12, ""probability"": 0.7353515625}]"
8,Puede que llueva mañana todo el día,67.9,70.2,2.3,eit_output_v3/038011_1A_preprocessed/responses/response_08.wav,puede que llueva mañana todo el día,puede que llueva mañana todo el día,Puede que lleve mañana todo el día.,prompted,False,0.1429,puede que llueva mañana todo el día,puede que llueva mañana todo el día,0.0,0.0,0.0,1.0,,1.0,7,7,0.0009,OK,mlx,8.249,"[{""word"": ""puede"", ""start"": 0.0, ""end"": 0.28, ""probability"": 0.35595703125}, {""word"": ""que"", ""start"": 0.28, ""end"": 0.46, ""probability"": 0.98291015625}, {""word"": ""llueva"", ""start"": 0.46, ""end"": 0.86, ""probability"": 0.477294921875}, {""word"": ""mañana"", ""start"": 0.86, ""end"": 1.14, ""probability"": 0.921875}, {""word"": ""todo"", ""start"": 1.14, ""end"": 1.6, ""probability"": 0.85595703125}, {""word"": ""el"", ""start"": 1.6, ""end"": 1.8, ""probability"": 0.888671875}, {""word"": ""día"", ""start"": 1.8, ""end"": 2.06, ""probability"": 0.8974609375}]"
9,Las casas son muy bonitas pero caras,79.1,82.6,3.5,eit_output_v3/038011_1A_preprocessed/responses/response_09.wav,las casas son muy bonitas pero caras,las casas son muy bonitas pero caras,"Las casas son muy bonitas, pero caras.",prompted,False,0.0,las casas son muy bonitas pero caras,las casas son muy bonitas pero caras,0.0,0.0,0.0,1.0,,1.0,7,7,0.0,OK,mlx,7.266,"[{""word"": ""las"", ""start"": 0.0, ""end"": 0.26, ""probability"": 0.0487060546875}, {""word"": ""casas"", ""start"": 0.26, ""end"": 0.64, ""probability"": 0.9892578125}, {""word"": ""son"", ""start"": 0.64, ""end"": 0.8, ""probability"": 0.98046875}, {""word"": ""muy"", ""start"": 0.8, ""end"": 1.04, ""probability"": 0.98974609375}, {""word"": ""bonitas"", ""start"": 1.04, ""end"": 1.7, ""probability"": 0.962890625}, {""word"": ""pero"", ""start"": 1.7, ""end"": 2.48, ""probability"": 0.58740234375}, {""word"": ""caras"", ""start"": 2.48, ""end"": 3.22, ""probability"": 0.9814453125}]"
10,Me gustan las películas que acaban bien,91.1,93.4,2.3,eit_output_v3/038011_1A_preprocessed/responses/response_10.wav,Me gustan las películas que acaban bien.,Me gustan las películas que acaban bien.,Me gustan las películas que acaban bien.,prompted,False,0.0,me gustan las películas que acaban bien,me gustan las películas que acaban bien,0.0,0.0,0.0,1.0,,1.0,7,7,0.0006,OK,mlx,7.332,"[{""word"": ""Me"", ""start"": 0.0, ""end"": 0.18, ""probability"": 0.98583984375}, {""word"": ""gustan"", ""start"": 0.18, ""end"": 0.54, ""probability"": 0.82421875}, {""word"": ""las"", ""start"": 0.54, ""end"": 0.66, ""probability"": 0.99658203125}, {""word"": ""películas"", ""start"": 0.66, ""end"": 1.42, ""probability"": 0.97412109375}, {""word"": ""que"", ""start"": 1.42, ""end"": 1.56, ""probability"": 0.99365234375}, {""word"": ""acaban"", ""start"": 1.56, ""end"": 1.96, ""probability"": 0.87744140625}, {""word"": ""bien."", ""start"": 1.96, ""end"": 2.14, ""probability"": 0.99951171875}]"
11,El chico con el que yo salgo es español,102.9,107.9,5.0,eit_output_v3/038011_1A_preprocessed/responses/response_11.wav,el chico conectivo salgo está bien,el chico conectivo salgo está bien,¿El chico conectivo salgo está bien?,prompted,False,0.0,el chico conectivo salgo está bien,el chico con el que yo salgo es español,0.6667,0.4103,0.6667,0.3333,,0.4286,9,6,0.0057,OK,mlx,7.3069999999999995,"[{""word"": ""el"", ""start"": 0.0, ""end"": 0.3, ""probability"": 0.03094482421875}, {""word"": ""chico"", ""start"": 0.3, ""end"": 0.64, ""probability"": 0.98046875}, {""word"": ""conectivo"", ""start"": 0.64, ""end"": 1.42, ""probability"": 0.8466796875}, {""word"": ""salgo"", ""start"": 1.42, ""end"": 2.26, ""probability"": 0.8232421875}, {""word"": ""está"", ""start"": 3.42, ""end"": 4.12, ""probability"": 0.12646484375}, {""word"": ""bien"", ""start"": 4.12, ""end"": 4.8, ""probability"": 0.98828125}]"
12,Después de cenar me fui a dormir tranquilo,115.7,120.8,5.1,eit_output_v3/038011_1A_preprocessed/responses/response_12.wav,Después de cenar me fui a poner tranquilo.,Después de cenar me fui a poner tranquilo.,"Después de cenar, me fui a poner tranquilo.",prompted,False,0.0,después de cenar me fui a poner tranquilo,después de cenar me fui a dormir tranquilo,0.125,0.0952,0.125,0.875,,0.875,8,8,0.0412,OK,mlx,6.812,"[{""word"": ""Después"", ""start"": 0.0, ""end"": 0.34, ""probability"": 0.916015625}, {""word"": ""de"", ""start"": 0.34, ""end"": 0.54, ""probability"": 0.99560546875}, {""word"": ""cenar"", ""start"": 0.54, ""end"": 1.08, ""probability"": 0.9912109375}, {""word"": ""me"", ""start"": 1.08, ""end"": 1.3, ""probability"": 0.443359375}, {""word"": ""fui"", ""start"": 1.3, ""end"": 1.6, ""probability"": 0.984375}, {""word"": ""a"", ""start"": 1.6, ""end"": 1.76, ""probability"": 0.98974609375}, {""word"": ""poner"", ""start"": 1.76, ""end"": 3.8, ""probability"": 0.6806640625}, {""word"": ""tranquilo."", ""start"": 3.8, ""end"": 5.0, ""probability"": 0.94970703125}]"
13,Quiero una casa en la que vivan mis animales,128.2,131.7,3.5,eit_output_v3/038011_1A_preprocessed/responses/response_13.wav,quiero una casa que vivan a mis animales,quiero una casa que vivan a mis animales,Quiero una casa que viven a mis animales.,prompted,False,0.125,quiero una casa que vivan a mis animales,quiero una casa en la que vivan mis animales,0.3333,0.1818,0.3333,0.6667,,0.8235,9,8,0.0564,OK,mlx,6.996,"[{""word"": ""quiero"", ""start"": 0.0, ""end"": 0.34, ""probability"": 0.058624267578125}, {""word"": ""una"", ""start"": 0.34, ""end"": 0.52, ""probability"": 0.97216796875}, {""word"": ""casa"", ""start"": 0.52, ""end"": 0.78, ""probability"": 0.99853515625}, {""word"": ""que"", ""start"": 0.78, ""end"": 1.04, ""probability"": 0.8828125}, {""word"": ""vivan"", ""start"": 1.04, ""end"": 1.56, ""probability"": 0.65234375}, {""word"": ""a"", ""start"": 1.56, ""end"": 2.32, ""probability"": 0.5576171875}, {""word"": ""mis"", ""start"": 2.32, ""end"": 2.52, ""probability"": 0.97900390625}, {""word"": ""animales"", ""start"": 2.52, ""end"": 2.96, ""probability"": 0.97998046875}]"
14,A nosotros nos fascinan las fiestas grandiosas,140.6,143.1,2.5,eit_output_v3/038011_1A_preprocessed/responses/response_14.wav,a nosotros que las fiestas,a nosotros que las fiestas,a nosotros que las visas,prompted,False,0.2,a nosotros que las fiestas,a nosotros nos fascinan las fiestas grandiosas,0.4286,0.5,0.4286,0.5714,,0.6667,7,5,0.0037,OK,mlx,18.817,"[{""word"": ""a"", ""start"": 0.0, ""end"": 0.26, ""probability"": 0.35791015625}, {""word"": ""nosotros"", ""start"": 0.26, ""end"": 0.66, ""probability"": 0.8203125}, {""word"": ""que"", ""start"": 0.66, ""end"": 1.08, ""probability"": 0.8818359375}, {""word"": ""las"", ""start"": 1.08, ""end"": 1.4, ""probability"": 0.399169921875}, {""word"": ""fiestas"", ""start"": 1.4, ""end"": 2.28, ""probability"": 0.427490234375}]"
15,Ella sólo bebe cerveza y no come nada,153.9,157.8,3.9,eit_output_v3/038011_1A_preprocessed/responses/response_15.wav,ella es toda la cerveza y... como...,ella es toda la cerveza y... como...,Ella es toda la inversa y... como...,prompted,False,0.1429,ella es toda la cerveza y como,ella sólo bebe cerveza y no come nada,0.75,0.4595,0.75,0.25,,0.4,8,7,0.0182,OK,mlx,8.028,"[{""word"": ""ella"", ""start"": 0.0, ""end"": 0.26, ""probability"": 0.119873046875}, {""word"": ""es"", ""start"": 0.26, ""end"": 0.36, ""probability"": 0.453369140625}, {""word"": ""toda"", ""start"": 0.36, ""end"": 0.54, ""probability"": 0.5849609375}, {""word"": ""la"", ""start"": 0.54, ""end"": 0.68, ""probability"": 0.89306640625}, {""word"": ""cerveza"", ""start"": 0.68, ""end"": 1.26, ""probability"": 0.5068359375}, {""word"": ""y..."", ""start"": 1.26, ""end"": 1.96, ""probability"": 0.6513671875}, {""word"": ""como..."", ""start"": 3.2, ""end"": 3.72, ""probability"": 0.677734375}]"
16,Me gustaría que el precio de las casas bajara,167.9,174.2,6.3,eit_output_v3/038011_1A_preprocessed/responses/response_16.wav,Me gustaría los precios de las caras para nada,Me gustaría los precios de las caras para nada,Me gustaría los precios de los caras para nada.,prompted,False,0.1111,me gustaría los precios de las caras para nada,me gustaría que el precio de las casas bajara,0.6667,0.3111,0.6667,0.3333,,0.4444,9,9,0.0014,OK,mlx,7.6,"[{""word"": ""Me"", ""start"": 0.0, ""end"": 0.22, ""probability"": 0.8564453125}, {""word"": ""gustaría"", ""start"": 0.22, ""end"": 0.56, ""probability"": 0.8564453125}, {""word"": ""los"", ""start"": 0.56, ""end"": 1.56, ""probability"": 0.91552734375}, {""word"": ""precios"", ""start"": 1.56, ""end"": 2.2, ""probability"": 0.958984375}, {""word"": ""de"", ""start"": 2.2, ""end"": 2.54, ""probability"": 0.98583984375}, {""word"": ""las"", ""start"": 2.54, ""end"": 3.56, ""probability"": 0.31982421875}, {""word"": ""caras"", ""start"": 3.56, ""end"": 4.34, ""probability"": 0.93994140625}, {""word"": ""para"", ""start"": 4.34, ""end"": 4.46, ""probability"": 0.287841796875}, {""word"": ""nada"", ""start"": 4.46, ""end"": 4.8, ""probability"": 0.9697265625}]"
17,Cruza a la derecha y después sigue todo recto,182.1,188.5,6.4,eit_output_v3/038011_1A_preprocessed/responses/response_17.wav,cruza a la derecha y sigue derecho,cruza a la derecha y sigue derecho,Cruza a la derecha y siga derecho.,prompted,False,0.1429,cruza a la derecha y sigue derecho,cruza a la derecha y después sigue todo recto,0.3333,0.2889,0.3333,0.6667,,0.75,9,7,0.0016,OK,mlx,7.413,"[{""word"": ""cruza"", ""start"": 0.0, ""end"": 0.64, ""probability"": 0.447021484375}, {""word"": ""a"", ""start"": 0.64, ""end"": 0.68, ""probability"": 0.75}, {""word"": ""la"", ""start"": 0.68, ""end"": 0.84, ""probability"": 0.98779296875}, {""word"": ""derecha"", ""start"": 0.84, ""end"": 1.52, ""probability"": 0.99560546875}, {""word"": ""y"", ""start"": 1.52, ""end"": 1.8, ""probability"": 0.935546875}, {""word"": ""sigue"", ""start"": 1.8, ""end"": 2.24, ""probability"": 0.120361328125}, {""word"": ""derecho"", ""start"": 2.24, ""end"": 5.94, ""probability"": 0.9248046875}]"
18,Ella ha terminado de pintar su apartamento,196.1,201.7,5.6,eit_output_v3/038011_1A_preprocessed/responses/response_18.wav,Ella ha terminado los apartamentos,Ella ha terminado los apartamentos,Ella ha terminado los apartamentos.,prompted,False,0.0,ella ha terminado los apartamentos,ella ha terminado de pintar su apartamento,0.5714,0.2857,0.5714,0.4286,,0.5,7,5,0.0011,OK,mlx,7.607,"[{""word"": ""Ella"", ""start"": 0.0, ""end"": 0.3, ""probability"": 0.87646484375}, {""word"": ""ha"", ""start"": 0.3, ""end"": 0.46, ""probability"": 0.92919921875}, {""word"": ""terminado"", ""start"": 0.46, ""end"": 1.46, ""probability"": 0.9833984375}, {""word"": ""los"", ""start"": 1.46, ""end"": 2.76, ""probability"": 0.82275390625}, {""word"": ""apartamentos"", ""start"": 2.76, ""end"": 5.1, ""probability"": 0.5869140625}]"
19,Me gustaría que empezara a hacer más calor pronto,208.5,214.9,6.4,eit_output_v3/038011_1A_preprocessed/responses/response_19.wav,me gustaría las hacer pronto,me gustaría las hacer pronto,Me gustaría las hacer pronto.,prompted,False,0.0,me gustaría las hacer pronto,me gustaría que empezara a hacer más calor pronto,0.5556,0.4694,0.5556,0.4444,,0.5714,9,5,0.0036,OK,mlx,10.553,"[{""word"": ""me"", ""start"": 0.0, ""end"": 0.2, ""probability"": 0.141845703125}, {""word"": ""gustaría"", ""start"": 0.2, ""end"": 0.62, ""probability"": 0.9443359375}, {""word"": ""las"", ""start"": 0.62, ""end"": 1.46, ""probability"": 0.55419921875}, {""word"": ""hacer"", ""start"": 1.46, ""end"": 1.96, ""probability"": 0.9794921875}, {""word"": ""pronto"", ""start"": 1.96, ""end"": 4.62, ""probability"": 0.80810546875}]"
20,El niño al que se le murió el gato está triste,222.6,226.6,4.0,eit_output_v3/038011_1A_preprocessed/responses/response_20.wav,el niño que se murió el gato está triste,el niño que se murió el gato está triste,El niño que se murió el gato está triste.,prompted,False,0.0,el niño que se murió el gato está triste,el niño al que se le murió el gato está triste,0.1818,0.1304,0.1818,0.8182,,0.8889,11,9,0.0074,OK,mlx,13.225,"[{""word"": ""el"", ""start"": 0.0, ""end"": 0.26, ""probability"": 0.039398193359375}, {""word"": ""niño"", ""start"": 0.26, ""end"": 0.56, ""probability"": 0.96826171875}, {""word"": ""que"", ""start"": 0.56, ""end"": 1.24, ""probability"": 0.90625}, {""word"": ""se"", ""start"": 1.24, ""end"": 1.48, ""probability"": 0.95068359375}, {""word"": ""murió"", ""start"": 1.48, ""end"": 2.1, ""probability"": 0.9462890625}, {""word"": ""el"", ""start"": 2.1, ""end"": 2.22, ""probability"": 0.59912109375}, {""word"": ""gato"", ""start"": 2.22, ""end"": 2.72, ""probability"": 0.990234375}, {""word"": ""está"", ""start"": 2.72, ""end"": 3.16, ""probability"": 0.6865234375}, {""word"": ""triste"", ""start"": 3.16, ""end"": 3.56, ""probability"": 0.99560546875}]"
21,Una amiga mía cuida a los niños de mi vecino,237.3,241.9,4.6,eit_output_v3/038011_1A_preprocessed/responses/response_21.wav,una amiga viene cuidar a los niños de mi vecino,una amiga viene cuidar a los niños de mi vecino,Una amiga viene cuidar a los niños a mi vecino.,prompted,False,0.1,una amiga viene cuidar a los niños de mi vecino,una amiga mía cuida a los niños de mi vecino,0.2,0.1364,0.2,0.8,,0.8,10,10,0.2076,OK,mlx,12.171,"[{""word"": ""una"", ""start"": 0.0, ""end"": 0.28, ""probability"": 0.046966552734375}, {""word"": ""amiga"", ""start"": 0.28, ""end"": 0.58, ""probability"": 0.970703125}, {""word"": ""viene"", ""start"": 0.58, ""end"": 0.94, ""probability"": 0.333740234375}, {""word"": ""cuidar"", ""start"": 0.94, ""end"": 1.76, ""probability"": 0.85693359375}, {""word"": ""a"", ""start"": 1.76, ""end"": 1.84, ""probability"": 0.46923828125}, {""word"": ""los"", ""start"": 1.84, ""end"": 1.98, ""probability"": 0.98828125}, {""word"": ""niños"", ""start"": 1.98, ""end"": 2.4, ""probability"": 0.98095703125}, {""word"": ""de"", ""start"": 2.4, ""end"": 3.1, ""probability"": 0.186279296875}, {""word"": ""mi"", ""start"": 3.1, ""end"": 3.3, ""probability"": 0.9794921875}, {""word"": ""vecino"", ""start"": 3.3, ""end"": 4.44, ""probability"": 0.974609375}]"
22,El gato que era negro fue perseguido por el perro,250.9,257.6,6.7,eit_output_v3/038011_1A_preprocessed/responses/response_22.wav,el gato era negro y el perro,el gato era negro y el perro,El gato era negro y... el perro.,prompted,False,0.0,el gato era negro y el perro,el gato que era negro fue perseguido por el perro,0.4,0.449,0.4,0.6,,0.6667,10,7,0.0054,OK,mlx,13.651,"[{""word"": ""el"", ""start"": 0.0, ""end"": 0.22, ""probability"": 0.1246337890625}, {""word"": ""gato"", ""start"": 0.22, ""end"": 0.8, ""probability"": 0.99609375}, {""word"": ""era"", ""start"": 0.8, ""end"": 1.6, ""probability"": 0.94091796875}, {""word"": ""negro"", ""start"": 1.6, ""end"": 2.12, ""probability"": 0.98876953125}, {""word"": ""y"", ""start"": 2.12, ""end"": 2.94, ""probability"": 0.8115234375}, {""word"": ""el"", ""start"": 2.94, ""end"": 5.3, ""probability"": 0.373046875}, {""word"": ""perro"", ""start"": 5.3, ""end"": 6.36, ""probability"": 0.9873046875}]"
23,Antes de poder salir él tiene que limpiar su cuarto,266.1,274.4,8.3,eit_output_v3/038011_1A_preprocessed/responses/response_23.wav,antes de que salir puede cuarto,antes de que salir puede cuarto,"Antes de que salir, fue de cuarto.",prompted,False,0.3333,antes de que salir puede cuarto,antes de poder salir él tiene que limpiar su cuarto,0.6,0.4902,0.6,0.4,,0.625,10,6,0.0028,OK,mlx,57.523,"[{""word"": ""antes"", ""start"": 0.0, ""end"": 0.46, ""probability"": 0.2237548828125}, {""word"": ""de"", ""start"": 0.46, ""end"": 0.7, ""probability"": 0.96435546875}, {""word"": ""que"", ""start"": 0.7, ""end"": 0.98, ""probability"": 0.83203125}, {""word"": ""salir"", ""start"": 0.98, ""end"": 1.98, ""probability"": 0.92333984375}, {""word"": ""puede"", ""start"": 4.819999999999999, ""end"": 5.52, ""probability"": 0.03924560546875}, {""word"": ""cuarto"", ""start"": 7.0, ""end"": 7.7, ""probability"": 0.72021484375}]"
24,La cantidad de personas que fuman ha disminuido,282.2,286.6,4.4,eit_output_v3/038011_1A_preprocessed/responses/response_24.wav,la cantidad de las personas fuman que me salido,la cantidad de las personas fuman que me salido,La cantidad de las personas que fuman que me he salido.,prompted,False,0.2222,la cantidad de las personas fuman que me salido,la cantidad de personas que fuman ha disminuido,0.625,0.383,0.625,0.375,,0.7059,8,9,0.0065,OK,mlx,37.966,"[{""word"": ""la"", ""start"": 0.0, ""end"": 0.26, ""probability"": 0.1815185546875}, {""word"": ""cantidad"", ""start"": 0.26, ""end"": 0.54, ""probability"": 0.98779296875}, {""word"": ""de"", ""start"": 0.54, ""end"": 0.88, ""probability"": 0.98828125}, {""word"": ""las"", ""start"": 0.88, ""end"": 1.36, ""probability"": 0.865234375}, {""word"": ""personas"", ""start"": 1.36, ""end"": 1.84, ""probability"": 0.99267578125}, {""word"": ""fuman"", ""start"": 1.84, ""end"": 2.6, ""probability"": 0.705078125}, {""word"": ""que"", ""start"": 2.6, ""end"": 3.12, ""probability"": 0.69580078125}, {""word"": ""me"", ""start"": 3.12, ""end"": 3.44, ""probability"": 0.67529296875}, {""word"": ""salido"", ""start"": 3.44, ""end"": 4.14, ""probability"": 0.35302734375}]"
25,Después de llegar a casa del trabajo tomé la cena,297.1,302.8,5.7,eit_output_v3/038011_1A_preprocessed/responses/response_25.wav,después de llegar a casa fui a la cena,después de llegar a casa fui a la cena,"Después de llegar a la casa, fui a la cena.",prompted,False,0.1111,después de llegar a casa fui a la cena,después de llegar a casa del trabajo tomé la cena,0.3,0.2857,0.3,0.7,,0.7778,10,9,0.0029,OK,mlx,124.919,"[{""word"": ""después"", ""start"": 0.0, ""end"": 0.42, ""probability"": 0.05950927734375}, {""word"": ""de"", ""start"": 0.42, ""end"": 0.64, ""probability"": 0.98876953125}, {""word"": ""llegar"", ""start"": 0.64, ""end"": 0.92, ""probability"": 0.82568359375}, {""word"": ""a"", ""start"": 0.92, ""end"": 1.26, ""probability"": 0.93701171875}, {""word"": ""casa"", ""start"": 1.26, ""end"": 1.48, ""probability"": 0.6337890625}, {""word"": ""fui"", ""start"": 4.18, ""end"": 4.74, ""probability"": 0.849609375}, {""word"": ""a"", ""start"": 4.74, ""end"": 4.92, ""probability"": 0.95068359375}, {""word"": ""la"", ""start"": 4.92, ""end"": 5.08, ""probability"": 0.97705078125}, {""word"": ""cena"", ""start"": 5.08, ""end"": 5.38, ""probability"": 0.890625}]"
26,El ladrón al que atrapó la policía era famoso,314.1,321.1,7.0,eit_output_v3/038011_1A_preprocessed/responses/response_26.wav,perdón a la policía eran famoso,perdón a la policía eran famoso,Perdón a la policía. Eran famoso.,prompted,False,0.0,perdón a la policía eran famoso,el ladrón al que atrapó la policía era famoso,0.6667,0.4222,0.6667,0.3333,,0.4,9,6,0.0009,OK,mlx,75.98700000000001,"[{""word"": ""perdón"", ""start"": 0.0, ""end"": 0.68, ""probability"": 0.48779296875}, {""word"": ""a"", ""start"": 0.68, ""end"": 0.82, ""probability"": 0.83349609375}, {""word"": ""la"", ""start"": 0.82, ""end"": 1.02, ""probability"": 0.9765625}, {""word"": ""policía"", ""start"": 1.02, ""end"": 2.9, ""probability"": 0.837890625}, {""word"": ""eran"", ""start"": 5.34, ""end"": 5.96, ""probability"": 0.65625}, {""word"": ""famoso"", ""start"": 5.96, ""end"": 6.52, ""probability"": 0.70751953125}]"
